{"$schema":"https://json-schema.org/draft/2020-12/schema","title":"QSOL-ARK Recovery Tier Registry","type":"object","additionalProperties":false,"required":["type","protocol","version","ordering_rule","tiers"],"properties":{"type":{"const":"qsol-ark-recovery-tiers"},"protocol":{"const":"QSOL-ARK"},"version":{"type":"string"},"ordering_rule":{"type":"string","minLength":1},"tiers":{"type":"array","minItems":1,"items":{"type":"object","additionalProperties":false,"required":["id","rank","name","implemented","environment","entrypoints","capabilities"],"properties":{"id":{"type":"string","pattern":"^T[0-9]+$"},"rank":{"type":"integer","minimum":0},"name":{"type":"string","minLength":1},"implemented":{"type":"boolean"},"environment":{"type":"array","items":{"type":"string"}},"entrypoints":{"type":"array","minItems":1,"items":{"type":"string"}},"capabilities":{"type":"array","items":{"type":"string"},"uniqueItems":true}}}}}}
